{
  "id": "knowledge-fragment-composition",
  "slug": "knowledge-fragment-composition",
  "title": "Knowledge Fragment Composition: Why We Ditched Generation for Retrieval",
  "meta_title": "Fragment Composition vs LLM Generation — ReLU.chat",
  "meta_description": "Retrieval + fragment composition is dramatically more accurate than LLM generation for domain-specific chatbots. Here is why we built ReLU.chat that way.",
  "status": "published",
  "published_at": "2026-06-06T09:00:00Z",
  "updated_at": "2026-06-06T09:00:00Z",
  "author": "ReLU.chat",
  "excerpt": "Generation is flexible and dangerous; retrieval is rigid and safe. For domain-specific chatbots where accuracy matters more than creativity, retrieval + fragment composition wins. Here is the design and the tradeoffs.",
  "content": "# Knowledge Fragment Composition\n\nEvery modern chatbot has to make a fundamental choice: **generate** responses token-by-token, or **retrieve** pre-written fragments and stitch them together. ReLU.chat picked the second path. This post explains why, and what we learned about doing it well.\n\n## The Generation Trap\n\nLarge language models are remarkable. They write coherent, contextually appropriate text on almost any topic. For an open-ended creative assistant, that is exactly what you want.\n\nFor a knowledge-grounded chatbot — a game-theory tutor, a documentation assistant, a scientific reference — generation has a fatal problem: **hallucination**. A model can produce text that is fluent, confident, and completely wrong. In a domain where users trust the bot to be accurate, that is unacceptable.\n\nWe tried the LLM path first. It worked for the happy path — clean queries, well-covered topics. It failed for edge cases:\n\n- A user asks about \"a theorem in game theory\" and gets a paraphrase of a different theorem\n- A query about a specific equation gets a formula that is *almost* right but subtly wrong\n- A user asks for the year of an event and the model invents a plausible but incorrect date\n\nThe accuracy floor is the issue. With generation you can never say \"this is grounded in the source.\"\n\n## The Retrieval Alternative\n\nA retrieval-based system works differently. You maintain a **knowledge base** of pre-written fragments, each one verified for accuracy. At query time you:\n\n1. Find the fragments most relevant to the query\n2. Decide which ones to include\n3. Connect them with linguistic glue\n4. Return the composed result\n\nThe output is *always* traceable to a source. Every fact came from a fragment that a human wrote and verified. The bot cannot hallucinate because it cannot generate new text — it can only assemble existing text.\n\nThe tradeoff is **flexibility**. If the user asks something not covered by the knowledge base, the system has to say so. There is no fallback to \"sounds-plausible-but-wrong.\" That is the whole point.\n\n## How ReLU.chat Composes\n\nA knowledge fragment looks like:\n\n```\n{\n  id: \"gt:nash:def\",\n  topic: \"nash-equilibrium\",\n  intent: \"definition\",\n  body: \"A Nash equilibrium is a set of strategies, one for each player, such that no player can benefit by unilaterally changing their strategy while the other players' strategies remain unchanged.\",\n  tags: [\"game-theory\", \"nash\", \"definition\"]\n}\n```\n\nFragments are small (1-3 sentences), focused on a single concept, and tagged with topic + intent. The intent tag is critical: it tells the policy network whether this fragment is a *definition*, an *example*, a *proof sketch*, a *comparison*, etc.\n\nAt query time the pipeline is:\n\n1. **Retrieve** — find top-k candidate fragments via BM25 + dense retrieval (see our [retrieval post](/blog/bm25-vs-dense-retrieval/))\n2. **Rank** — score candidates with the policy network\n3. **Select** — pick the fragments to include (typically 1-3)\n4. **Order** — decide the sequence (e.g., definition before example)\n5. **Connect** — insert linguistic connectors (\"To illustrate this,\", \"In contrast,\", \"Specifically,\")\n6. **Format** — wrap in LaTeX for math, code blocks for snippets, lists for enumerations\n\nThe result reads naturally because the connectors are doing real linguistic work, and the fragments themselves are written in a consistent style.\n\n## What the Policy Network Decides\n\nThe 6 action heads of the policy network control:\n\n- **Fragment selection** — which fragments from the candidate set to include\n- **Response length** — concise (one fragment) vs detailed (multiple fragments + connectors)\n- **Connector style** — formal vs conversational, with or without transitions\n- **Confidence display** — whether to show the source attribution, hedge, or not\n- **Creativity balance** — pure retrieval vs light paraphrasing of fragment text\n- **Follow-up generation** — whether to suggest related topics at the end\n\nThe policy learns these from interaction data via reinforcement learning (see our [RL post](/blog/reinforcement-learning-for-chatbots/)). It is not a hand-tuned heuristic — it is a 13K-parameter MLP trained on thousands of real interactions.\n\n## What Goes Wrong\n\nRetrieval + composition is not magic. The failure modes are different from generation but they exist:\n\n- **Coverage gaps** — the knowledge base simply does not cover the query. The bot has to say \"I don't have information on that.\"\n- **Stitching artifacts** — the connectors can sound formulaic if overused. The policy has to learn when *not* to connect.\n- **Stale fragments** — the knowledge base does not auto-update. A new theorem published yesterday is not in the bot's KB.\n- **Topic drift** — the retriever returns fragments that are semantically related but topically wrong. A query about \"Nash equilibrium\" might return a fragment about \"Walrasian equilibrium\" if the embeddings are confused.\n\nThe mitigations:\n\n- For coverage: detect low-confidence retrievals and explicitly say so\n- For stitching: train the policy to use connectors sparingly\n- For staleness: this is a maintenance burden; KB updates are manual\n- For drift: use the intent tag in retrieval scoring — a query looking for a *definition* should weight definition-tagged fragments higher\n\n## Why We Picked This\n\nFor a knowledge-grounded chatbot, retrieval + composition gives you:\n\n- **Verifiable accuracy** — every claim is traceable\n- **Smaller models** — no need for a 7B parameter LLM, a 22MB retriever is enough\n- **Faster inference** — retrieval is microseconds, generation is hundreds of milliseconds\n- **On-device viability** — the whole system runs in 22MB; an LLM in the browser is still hard\n\nWe trade flexibility for accuracy, and we trade the magic of generation for the honesty of retrieval. For our use case — domain-specific, accuracy-critical, privacy-first — that is exactly the right tradeoff.",
  "cover_image": "assets/blog/fragment-composition.svg",
  "cover_image_alt": "Pastel diagram showing knowledge fragments being retrieved, selected, and composed with connectors",
  "tags": ["retrieval", "nlp", "on-device-ai", "chatbots", "knowledge-base"],
  "redirects": []
}
