{
  "id": "sentence-embeddings-384-dim-minilm",
  "slug": "sentence-embeddings-384-dim-minilm",
  "title": "Sentence Embeddings Explained: Why 384 Dimensions and What They Mean",
  "meta_title": "384-dim Sentence Embeddings — ReLU.chat",
  "meta_description": "Why sentence transformers use 384 dimensions, what those numbers actually represent, and why MiniLM-L6 is a sweet spot for browser NLP.",
  "status": "published",
  "published_at": "2026-06-05T10:00:00Z",
  "updated_at": "2026-06-05T10:00:00Z",
  "author": "ReLU.chat",
  "excerpt": "384 is a specific number with a specific history. It is the output dimension of MiniLM-L6-v2, a distilled sentence transformer. Here is what those dimensions actually encode, why the number is what it is, and why it is the right size for browser NLP.",
  "content": "# Sentence Embeddings: 384 Dimensions\n\nWhen we say ReLU.chat embeds text into \"384 dimensions,\" it sounds arbitrary. It is not. The 384-dim output is a deliberate design choice for `all-MiniLM-L6-v2`, the sentence transformer we use. This post explains what those numbers mean, why the dimension count is what it is, and what that implies for browser deployment.\n\n## What a Sentence Embedding Is\n\nA sentence embedding is a fixed-length vector of real numbers that represents the *meaning* of a sentence. Two sentences with similar meaning should have similar vectors. The similarity is measured by cosine distance:\n\n```\nsimilarity(A, B) = (A · B) / (||A|| * ||B||)\n```\n\nThe vector lives in a high-dimensional space. Cosine similarity ranges from -1 (opposite) to 1 (identical). For semantically related sentences, you typically see 0.6-0.9.\n\nA 384-dimensional vector is just 384 numbers. For the sentence \"A Nash equilibrium is a strategy profile where no player wants to deviate,\" one dimension might loosely correspond to \"game theory,\" another to \"stability,\" another to \"multi-agent,\" and so on. But it is misleading to assign labels to dimensions — they are learned, not interpretable, and the meaning is distributed across them.\n\n## Why 384 Specifically\n\nThe choice of 384 is the result of three competing pressures:\n\n**Accuracy** — more dimensions means more capacity to encode nuance. BERT-base uses 768, BERT-large uses 1024. Larger vectors discriminate better between similar concepts.\n\n**Storage** — a 384-dim FP32 vector is 1.5 KB. For a knowledge base of 10,000 fragments, that is 15 MB. At 768 dims it would be 30 MB. At 1024 dims, 40 MB.\n\n**Latency** — every dimension requires work in the transformer. 384 dims of computation is roughly half of 768. For browser inference this matters.\n\nMiniLM-L6-v2 chose 384 because the original `all-MiniLM-L12-v2` (12-layer) at 384 dim was already nearly as accurate as BERT-base at 768 dim for sentence-similarity benchmarks. The number 384 is not fundamental — it is the point where the model is \"good enough\" for the size and speed budget.\n\n## How It Is Learned\n\nA sentence transformer is trained with a contrastive objective. The model sees pairs of sentences and learns to:\n\n- Make similar sentences have similar embeddings\n- Make dissimilar sentences have dissimilar embeddings\n\nThe training data is huge — typically 1B+ sentence pairs from web crawl, Q&A sites, and paraphrase databases. The loss function is something like:\n\n```\nL = max(0, margin - cos(A, A_positive) + cos(A, A_negative))\n```\n\nOr, in the more modern setup, a softmax over in-batch negatives scaled by a temperature. Either way, the model is rewarded for pulling similar sentences together and pushing dissimilar ones apart in the embedding space.\n\nThe \"L6\" in MiniLM-L6-v2 means 6 transformer layers. The original BERT-base has 12. The L6 model is smaller and faster but slightly less accurate. For a retrieval system that already uses BM25 as a complement, the L6 accuracy is sufficient.\n\n## What 384 Dimensions Actually Encode\n\nThe dimensions are not labeled. But we can probe them. If you train a linear probe on dimension 47 (or whatever), you might find that it correlates with the *presence of a named entity*, or *sentiment polarity*, or *tense of the main verb*. The model has learned to allocate dimensions to whatever signals help minimize the contrastive loss.\n\nEmpirically, MiniLM-L6-v2's dimensions encode a mix of:\n\n- **Topical signals** — what the sentence is about\n- **Syntactic signals** — grammar, structure, length\n- **Semantic relations** — synonymy, entailment, contradiction\n- **Style markers** — formal vs informal, technical vs general\n\nBut the encoding is **entangled** — a single dimension participates in multiple concepts. That is why you cannot interpret individual dimensions in isolation.\n\n## The Practical Sweet Spot\n\nFor a browser-deployed retrieval system, 384 dim hits a sweet spot:\n\n- **Accuracy**: 90-95% of full BERT-base for sentence similarity tasks\n- **Size**: 22 MB quantized, fits on a phone in seconds\n- **Latency**: ~15ms per embedding on a mid-range laptop, ~3ms on WebGPU\n- **Storage**: 15 MB for 10,000 KB fragments — acceptable\n\nIf you go to 768 dim, the storage doubles and the inference is ~2x slower. If you go to 128 dim, you lose too much accuracy. 384 is the local minimum of the pain curve.\n\n## What This Means for Users\n\nThe user does not see \"384 dimensions.\" They see a chatbot that:\n\n- Recognizes paraphrases (\"how do I split profits fairly\" → finds \"Shapley value\")\n- Handles synonyms (\"auction\" ↔ \"sealed-bid mechanism\")\n- Tolerates typos and slight rewordings\n- Fails gracefully on out-of-domain queries (low similarity → no good match)\n\nThat is what 384 numbers buy you. Not magic — careful engineering and a model trained on more text than any human can read in a lifetime.",
  "cover_image": "assets/blog/sentence-embeddings.svg",
  "cover_image_alt": "Pastel illustration of a 384-dimensional vector space with semantically related sentences clustered together",
  "tags": ["embeddings", "nlp", "sentence-transformers", "machine-learning", "minilm"],
  "redirects": []
}
