{"author": "ReLU.chat", "content": "# Dropout and Regularization for Tiny MLPs\n\nSmall networks trained on small datasets memorize fast. Regularization trades a little training accuracy for better behavior on unseen inputs. Dropout is the most famous technique, but for tiny MLPs the full toolkit — weight decay, early stopping, and noise — matters more than any single trick.\n\n## How dropout works\n\nDuring training, dropout randomly zeroes each hidden activation with probability p (typically 0.1 to 0.5) and scales survivors by `1 / (1 - p)` to preserve expected magnitudes. Each update trains a different random sub-network; at inference, dropout turns off and the full network predicts.\n\n```javascript\nfunction dropoutForward(activations, p, training) {\n  if (!training || p <= 0) return activations;\n  const scale = 1 / (1 - p);\n  return activations.map(a => (Math.random() < p ? 0 : a * scale));\n}\n```\n\nThe effect: no neuron can rely on any other neuron always being present, so representations spread across the layer instead of concentrating in a few units.\n\n## When dropout hurts tiny networks\n\nDropout was designed for large networks with redundancy to spare. A 128-unit hidden layer tolerates p=0.3; a 16-unit layer may not — dropping a third of 16 units destroys too much signal per update. For tiny MLPs (tens of units), use p=0.1 or skip dropout in favor of stronger alternatives.\n\n## Weight decay and early stopping\n\n- **Weight decay (L2):** add `lambda * sum(w^2)` to the loss, penalizing large weights. Start near 1e-4 and tune on validation. It costs one line and helps almost every small network.\n- **Early stopping:** keep the checkpoint with the best validation score and stop when validation stalls for N epochs. It is free regularization that also saves training time.\n\nBoth techniques suit [CPU training budgets](/blog/tiny-policy-training-cpu/) perfectly: no extra compute, no architecture changes, and early stopping shortens runs.\n\n## Noise as regularization\n\nSmall input noise — jittering [normalized features](/blog/feature-normalization-ml-beginners/) by 1% during training — smooths decision boundaries similarly to dropout but without touching the architecture. For policy networks trained with [reward signals](/blog/reward-design-small-chatbot/), action-space noise (epsilon-greedy exploration) doubles as both regularizer and data collector.\n\n## A regularization recipe\n\nFor a tiny MLP on hundreds of examples: standardize inputs, add weight decay at 1e-4, train with a decaying [learning rate](/blog/learning-rate-schedules-small-networks/), and early-stop on a [grouped validation split](/blog/grouped-validation-leakage/). Add light dropout (p=0.1) only if validation still trails training by a wide margin. Measure every addition with [cross-validation](/blog/cross-validation-small-ml-datasets/) — regularization you cannot measure is superstition.", "cover_image_alt": "Neural layer with randomly dropped connections", "excerpt": "Tiny MLPs memorize small datasets fast. Learn dropout mechanics, when it hurts small layers, weight decay, early stopping, and a full recipe.", "id": "dropout-regularization-tiny-mlp", "meta_description": "Regularize tiny MLPs: dropout mechanics, weight decay, early stopping, and input noise, with a measured recipe and code.", "meta_title": "Dropout & Regularization for Tiny MLPs", "published_at": "2026-10-03T10:00:00Z", "redirects": [], "slug": "dropout-regularization-tiny-mlp", "status": "published", "tags": ["neural-networks", "ml", "training", "beginners"], "title": "Dropout and Regularization for Tiny MLPs"}