{
  "id": "debugging-browser-ml",
  "slug": "debugging-browser-ml",
  "title": "Debugging In-Browser ML: Profiling, Logging and Graceful Fallbacks",
  "meta_title": "Debugging In-Browser ML: Profiling, Logging & Fallbacks",
  "meta_description": "Practical techniques for debugging browser-based ML: profiling inference stages, structured on-device logging, and graceful fallback paths.",
  "status": "published",
  "published_at": "2026-08-06T07:30:00.000Z",
  "updated_at": "2026-08-06T07:30:00.000Z",
  "author": "ReLU.chat",
  "content": "# Debugging In-Browser ML: Profiling, Logging and Graceful Fallbacks\n\nWhen machine learning runs on your server, debugging is familiar territory: you have logs, profilers, stack traces, and a machine you control. When the same model runs inside a visitor's browser, every assumption changes. The runtime is a different GPU, CPU, or mobile browser each time. Memory is constrained. WebGL, WebGPU, and WASM backends behave differently. And once the page is closed, all evidence disappears with it.\n\nDebugging in-browser ML therefore needs three layers of defense. First, profile the inference path so you know where time and memory actually go. Second, log structured events so failures are reconstructable after the fact. Third, build graceful fallbacks so the worst outcome is a slower answer, never a blank page.\n\n## Profile the Inference Path First\n\nDo not guess where the latency is. Measure each stage separately: model download, weight deserialization, session creation, input preprocessing, and `session.run` itself. A single `performance.now()` around the whole pipeline will hide the stage that regressed.\n\n```js\nconst t0 = performance.now();\nconst output = await session.run(inputs);\nconst elapsed = performance.now() - t0;\nlogEvent(\"inference\", {\n  elapsed,\n  backend: session.handler,        // e.g. \"webgpu\", \"webgl\", \"wasm\"\n  inputTokens: inputs.shape[1]\n});\n```\n\nA few findings this pattern typically surfaces:\n\n- The first inference on a backend is always slower than the rest. Warmup costs (shader compilation, WebGPU pipeline creation) can dwarf steady-state inference by an order of magnitude.\n- Backend selection matters more than model size. A 22 MB quantized ONNX model on a slow WASM fallback can take longer per query than the same model on WebGL, even though the bytes are identical.\n- Feature extraction and post-processing are frequently slower than the model itself. Tokenization, padding, and top-k selection all show up here.\n\nThe performance techniques ReLU.chat documents — query embedding memoization, bounded top-k selection instead of full sorts, LRU caches, and pre-built BM25 IDF values — are exactly the output of this profiling exercise. Every one of them is a profiler finding turned into a code change.\n\nMemory is the other half of profiling. `performance.memory` is only available in Chromium, so track what you can: the `byteLength` of your typed arrays, the sizes of tensors returned by each `session.run`, and the growth of caches across turns. A common failure is unbounded caching — embeddings and retrieval results stored per turn with no eviction policy. ReLU.chat bounds this with LRU caches, query embedding memoization, and a 30-turn session window. Without the same discipline, memory grows linearly with conversation length until the tab dies.\n\n## Log Structured Events, Not Console Log Soup\n\n`console.log` strings are fine for interactive debugging and useless for everything else. What you want is a small ring buffer of structured events, each with a timestamp, a stage name, and a few fields. Keep the buffer on-device; a privacy-first product with no tracking should never ship telemetry that leaves the browser.\n\n```js\nconst eventBuffer = [];\nfunction logEvent(stage, fields) {\n  eventBuffer.push({ stage, ts: performance.now(), ...fields });\n  if (eventBuffer.length > 500) eventBuffer.shift();\n}\n```\n\nCorrelate events across stages with a single turn ID so a user's message produces one trace: intent classification, retrieval, policy inference, generation, render. When a user reports \"it answered instantly but the answer was wrong,\" the trace tells you which stage produced the output. When they report \"it hung for ten seconds,\" the trace tells you where the gap is.\n\nThe browser DevTools Performance panel is the second half of this story. Because everything runs locally, every model load and inference appears as a flame chart entry you can inspect without any server access.\n\n## The Three-Stage Pipeline Is a Built-In Debugger\n\nProgressive loading — ReLU.chat loads in three stages: a heuristic/BOW fallback for instant first turns, then the MLP policy, then a hot-swap to the full dense MiniLM model — is a feature, but it is also a diagnostic instrument. Every response can be tagged with the stage that produced it:\n\n- Stage 1 answer when stage 3 was expected: the ~22 MB model failed to load or the service worker cache missed.\n- Stage 2 answer when stage 1 was expected: the policy weights loaded, so the fallback was skipped as designed.\n- Full model answer: the normal path, and the one to benchmark against.\n\nTagging responses with their producing stage turns user bug reports into precise signals. \"It started answering weird after a few turns\" becomes \"stage 1 was answering for the whole session,\" which points straight at a weight-load failure rather than a ranking bug.\n\n## Build Graceful Fallbacks for Every Failure Mode\n\nAssume every load can fail and every numeric result can be nonsense. Design the degradation chain in advance:\n\n- Weight load failure falls back to the 15 parameterized heuristic decision thresholds used during cold start, so the chat still functions with rule-based behavior.\n- Missing or corrupt cached weights trigger a fresh download instead of a crash.\n- NaN checks on embeddings catch silent numeric corruption before it poisons cosine similarity. A single NaN in a 384-dimensional vector makes every downstream comparison meaningless.\n- Feature normalization should clip and scale defensively, because a NaN or Infinity in one input feature can propagate through an MLP to every action head.\n\n```js\n// Cheap finite check before any similarity computation\nif (!Number.isFinite(embedding.reduce((s, v) => s + v, 0))) {\n  return fallbackTo(\"stage-1\", \"non-finite embedding\");\n}\n```\n\nA useful mental model: the fallback chain should be a ladder, not a cliff. Full model, then quantized policy, then heuristics, then a polite plain-text answer. Each rung trades quality for reliability, and no rung should ever render a blank screen.\n\n## Key Takeaway\n\nIn-browser ML fails differently from server ML, so it must be debugged differently: profile each inference stage separately, keep structured on-device event logs correlated by turn, use the progressive-loading stage tags as a diagnostic signal, and always have a graceful fallback ladder so a model failure degrades to a slower answer instead of a broken page. Measure first, log second, and assume the model will sometimes not load at all.",
  "excerpt": "Debugging ML that runs in the browser needs three layers of defense: profiling each inference stage, logging structured on-device events, and building a graceful fallback ladder so a model failure degrades to a slower answer instead of a blank page.",
  "canonical": "https://relu.chat/blog/debugging-browser-ml/",
  "cover_image": "",
  "cover_image_alt": "Debugging In-Browser ML: Profiling, Logging and Graceful Fallbacks",
  "tags": [
    "debugging",
    "browser-ml",
    "profiling",
    "fallbacks"
  ],
  "redirects": []
}
