{"author": "ReLU.chat", "content": "# BLEU and ROUGE: Text Generation Metrics Explained\n\nWhen a system writes text — summaries, translations, composed answers — how do you score it without reading every output? BLEU and ROUGE compare generated text against human references using n-gram overlap. They are imperfect but fast, standard, and good enough to rank systems during development.\n\n## BLEU: precision over n-grams\n\nBLEU measures how much of the generated text appears in the reference. It computes precision for unigrams through 4-grams, takes a geometric mean, and multiplies by a brevity penalty that punishes outputs shorter than the reference:\n\n```javascript\nfunction ngramPrecision(candidate, reference, n) {\n  const refCounts = countNgrams(reference, n);\n  const candCounts = countNgrams(candidate, n);\n  let clipped = 0, total = 0;\n  for (const [g, c] of candCounts) {\n    clipped += Math.min(c, refCounts.get(g) || 0);\n    total += c;\n  }\n  return total ? clipped / total : 0;\n}\n```\n\nClipping caps each n-gram's credit at its reference count, so repeating 'the the the' cannot game the score. The brevity penalty is `exp(1 - refLen / candLen)` when the candidate is shorter, else 1.\n\n## ROUGE: recall over n-grams\n\nROUGE flips the emphasis: how much of the reference appears in the generated text. ROUGE-1 and ROUGE-2 measure unigram and bigram recall; ROUGE-L measures the longest common subsequence, rewarding fluent word order even with gaps. Summarization research reports ROUGE because missing reference content is the failure mode that matters — a summary that omits the key point fails no matter how fluent it is.\n\nFor [extractive summarization](/blog/summarization-extractive-browser/), ROUGE recall is naturally high since outputs copy source sentences. Compare systems with ROUGE F1 to balance coverage against verbosity.\n\n## What the scores mean\n\nNeither metric has an absolute scale. BLEU in the 30s is solid for translation; ROUGE-1 F1 near 0.4 is respectable for summarization. Use them comparatively: same references, same tokenizer, different systems. A two-point BLEU gap between your own checkpoints is meaningful; comparing your BLEU against another paper's number usually is not, because tokenization and reference counts differ.\n\n## Known blind spots\n\nBoth metrics match exact n-grams, so fluent paraphrases score poorly while awkward near-copies score well. They ignore factuality entirely — a summary can score highly while negating the source. For chatbot answers, pair overlap metrics with [retrieval accuracy](/blog/retrieval-metrics-precision-recall-mrr/): first verify the system found the right knowledge, then check the wording resembles a good answer.\n\n## Practical workflow\n\nKeep 50 to 100 reference outputs for representative queries, freeze them, and compute BLEU/ROUGE on every change alongside your [offline ranking tests](/blog/chatbot-evaluation-offline-test-sets/). When overlap scores and human spot-checks agree, ship. When they disagree, trust the humans and investigate — the metric is a proxy, not the goal.", "cover_image_alt": "Generated text compared against reference n-grams", "excerpt": "BLEU and ROUGE score generated text with n-gram overlap. Learn how each works, what scores mean, their blind spots, and practical use.", "id": "bleu-rouge-text-metrics-explained", "meta_description": "BLEU and ROUGE explained: n-gram precision vs recall, interpreting scores, blind spots, and chatbot workflows, with code.", "meta_title": "BLEU and ROUGE Text Metrics Explained", "published_at": "2026-09-28T10:00:00Z", "redirects": [], "slug": "bleu-rouge-text-metrics-explained", "status": "published", "tags": ["evaluation", "nlp", "metrics", "beginners"], "title": "BLEU and ROUGE: Text Generation Metrics Explained"}