{
  "id": "service-worker-caching-strategies",
  "slug": "service-worker-caching-strategies",
  "title": "Service Worker Caching Strategies for ML Assets",
  "meta_title": "Service Worker Caching for ML Assets — ReLU.chat",
  "meta_description": "Cache-first for immutable model weights, stale-while-revalidate for indexes, versioned caches: a practical guide for browser ML assets.",
  "status": "published",
  "published_at": "2026-08-02T10:00:00.000Z",
  "updated_at": "2026-08-02T10:00:00.000Z",
  "author": "ReLU.chat",
  "content": "# Service Worker Caching Strategies for ML Assets\n\nModel weights are the least cache-friendly-looking assets on the web: they are big, binary, and versioned. A quantized ONNX model is often tens of megabytes, and a naive fetch on every visit turns a fast on-device experience into a long spinner. But weights are also the most cache-friendly assets in one crucial sense: they are immutable. A released model file is not edited in place; a new model is a new URL. That single property makes cache-first the right default, and turns the whole problem into choosing the right strategy per asset type.\n\nReLU.chat ships a quantized all-MiniLM-L6-v2 ONNX model of roughly 22 MB, a small policy network, and pre-built BM25 IDF data. None of these change between visits, and all of them are expensive to re-fetch. This post walks through the strategies that make sense for each kind of ML asset.\n\n## The Four Caching Strategies\n\nService worker caching comes down to four strategies, and each fits a different asset class.\n\n1. **Cache-first**: serve from cache if present, fetch and cache on miss. Best for immutable, large assets: model weights, embedding indexes, precomputed IDF tables.\n2. **Network-first**: try the network, fall back to cache. Best for content that changes: the HTML shell, updated knowledge fragments.\n3. **Stale-while-revalidate**: serve the cached copy immediately, update it in the background. Best for medium-weight assets where freshness matters but speed matters more.\n4. **Network-only**: never cache. Best for anything that must be current, such as user-uploaded data.\n\nA single fetch handler can route by URL pattern:\n\n```javascript\nself.addEventListener('fetch', (event) => {\n  const url = new URL(event.request.url);\n\n  if (url.pathname.endsWith('.onnx')) {\n    event.respondWith(cacheFirst(event.request));\n  } else if (url.pathname.startsWith('/data/')) {\n    event.respondWith(staleWhileRevalidate(event.request));\n  } else {\n    event.respondWith(networkFirst(event.request));\n  }\n});\n```\n\nThe cache-first implementation is short:\n\n```javascript\nasync function networkFirst(request) {\n  const cache = await caches.open('relu-chat-v3');\n  try {\n    const response = await fetch(request);\n    if (response.ok) cache.put(request, response.clone());\n    return response;\n  } catch (error) {\n    const cached = await cache.match(request);\n    if (cached) return cached;\n    throw error;\n  }\n}\n```\n\nNetwork-first is the mirror image: try the network, and only on failure fall back to the cache. It trades a slower typical case (one network round trip instead of zero) for guaranteed freshness, which is why it belongs on the shell and on any content that changes between deploys.\n\n```javascript\nasync function cacheFirst(request) {\n  const cache = await caches.open('relu-chat-v3');\n  const cached = await cache.match(request);\n  if (cached) return cached;\n\n  const response = await fetch(request);\n  if (response.ok) cache.put(request, response.clone());\n  return response;\n}\n```\n\n## Precache at Install, Cache at Runtime\n\nThere are two moments to fill the cache. At `install`, the service worker can precache everything the app needs to start: the HTML shell, the policy network, the BM25 IDF table, and — if the user is willing to wait — the 22 MB model. Precache is where the \"instant on second visit\" property comes from.\n\n```javascript\nself.addEventListener('install', (event) => {\n  event.waitUntil(\n    caches.open('relu-chat-v3').then((cache) =>\n      cache.addAll([\n        '/',\n        '/models/all-MiniLM-L6-v2.onnx',\n        '/models/policy.onnx',\n        '/data/bm25-idf.json',\n      ])\n    )\n  );\n});\n```\n\nRuntime caching fills the gaps: pages the user visits, knowledge fragments fetched on demand, any asset the precache list did not cover. `cache.addAll` fails atomically — if one URL in the list fails, nothing is cached — so keep the precache list to URLs you know resolve, and let large model files be added lazily or after the first successful fetch.\n\nA practical pattern for a large model: do not block `install` on a 22 MB download over a slow connection. Instead, precache the small shell assets at install, and let the app trigger the model download with an explicit fetch that populates the runtime cache while a lightweight fallback answers the first turns. ReLU.chat's progressive loading does exactly this: the first turns are answered by a heuristic/BOW fallback while the model and policy weights load, and the service worker pre-caches those weights so the hot-swap to the full dense model never waits on the network.\n\n## Versioning and Cache Busting\n\nCaches are keyed by request URL, so an updated model needs an updated URL or an updated cache name. The robust pattern is to include a version in the cache name and delete old caches on `activate`:\n\n```javascript\nself.addEventListener('activate', (event) => {\n  event.waitUntil(\n    caches.keys().then((keys) =>\n      Promise.all(\n        keys.filter((key) => key !== 'relu-chat-v3').map((key) => caches.delete(key))\n      )\n    )\n  );\n});\n```\n\nFor model files specifically, prefer content-hashed URLs (`all-MiniLM-L6-v2.a1b2c3.onnx`). A hash in the filename means a changed model is a new URL, so the old entry can stay in cache until `activate` cleans it, and cache-first stays correct with zero coordination.\n\n## Practical Notes for ML-Sized Assets\n\n- **Quota**: Cache Storage is quota-bounded. A 22 MB model plus an embedding index can exhaust quota on low-end devices or in private browsing mode, where caches are often ephemeral. Handle `cache.match` misses by falling back to `fetch` and showing a progress indicator instead of failing silently.\n- **Cloning**: `cache.put` consumes the response body, so always pass `response.clone()` when you also return the response to the page.\n- **Streaming**: you can stream a large model into the cache while the first bytes are already being consumed, but in practice it is simpler to fetch fully, transfer the buffer to a worker, and cache the same response for the next visit.\n- **Do not cache private responses**: if user data ever flows through the service worker, keep those requests network-only.\n\n## Key Takeaway\n\nML assets are immutable, large, and versioned — cache-first with content-hashed URLs is the right default for weights and indexes, while the shell and dynamic data get network-first or stale-while-revalidate treatment. Precache what the app needs to start, let progressive loading fill in the heavy model behind a lightweight fallback, version your caches, and respect quota. Done right, the second visit is instant and the first visit never waits on the model.\n",
  "excerpt": "Model weights are immutable and large, which makes them ideal cache-first assets. A practical guide to service worker strategies for ML: precache, versioning, and quota.",
  "canonical": "https://relu.chat/blog/service-worker-caching-strategies/",
  "cover_image": "",
  "cover_image_alt": "Service Worker Caching Strategies for ML Assets",
  "tags": [
    "service-worker",
    "caching",
    "performance",
    "offline",
    "on-device"
  ],
  "redirects": []
}