{"author": "ReLU.chat", "content": "# Extractive Summarization for Long Answers\n\nWhen retrieved knowledge runs long, users benefit from a compressed view: the three sentences that matter most. Extractive summarization picks those sentences from the source text instead of generating new ones, which guarantees every word in the summary actually appeared in the documents.\n\n## Sentence scoring with word frequencies\n\nThe simplest extractor scores each sentence by the sum of its words' frequencies, normalized by sentence length. Frequent content words indicate the document's main topics, so sentences dense in them are likely representative:\n\n```javascript\nfunction summarize(sentences, topK = 3) {\n  const freq = new Map();\n  for (const s of sentences)\n    for (const w of contentWords(s))\n      freq.set(w, (freq.get(w) || 0) + 1);\n  const scored = sentences.map((s, i) => {\n    const words = contentWords(s);\n    const sum = words.reduce((a, w) => a + (freq.get(w) || 0), 0);\n    return { s, i, score: words.length ? sum / words.length : 0 };\n  });\n  return scored.sort((a, b) => b.score - a.score).slice(0, topK)\n    .sort((a, b) => a.i - b.i).map(x => x.s);\n}\n```\n\nNote the final re-sort into original order: summaries read far better when sentences keep their source sequence.\n\n## Position and title bonuses\n\nPure frequency scoring misses structural cues. Two cheap bonuses help a lot: boost sentences near the start of each section (topic sentences live there), and boost sentences sharing words with the title or the user's query. Query-biased scoring turns a generic summary into an answer-focused one — exactly what a chatbot needs.\n\n## Removing redundancy\n\nTop-scoring sentences often say the same thing twice. After picking the best sentence, penalize remaining candidates by their word overlap with already-chosen ones (maximal marginal relevance in miniature). A Jaccard overlap penalty of 50% or more keeps summaries diverse without any embeddings.\n\n## Extractive versus generative\n\nGenerative summarizers rewrite content fluently but can hallucinate details — dangerous when answers cite sources. Extractive summaries are choppier but faithful by construction: each sentence links back to its fragment. For a [fragment-composed chatbot](/blog/knowledge-fragment-composition/), extraction fits naturally: select the best sentences from the top-ranked fragments and join them with [linguistic connectors](/blog/linguistic-connectors-naturalness/).\n\n## Evaluation and limits\n\nMeasure summary quality with [ROUGE](/blog/bleu-rouge-text-metrics-explained/), which counts n-gram overlap against reference summaries. Expect extractive methods to score well on ROUGE recall — they copy source phrases verbatim — while trailing humans on coherence.\n\nExtraction fails when the answer needs synthesis across documents ('compare X and Y') rather than selection within them. Detect comparison and how-to intents with your [intent classifier](/blog/prototype-intent-classification/) and fall back to structured templates for those cases instead of forcing extraction.", "cover_image_alt": "Top sentences selected from a long document as summary", "excerpt": "Extractive summarization picks the sentences that matter, guaranteeing faithful summaries. Learn frequency scoring, redundancy removal, and chatbot uses.", "id": "summarization-extractive-browser", "meta_description": "Extractive summarization for chatbots: sentence scoring, redundancy removal, and faithful long-answer compression, with code.", "meta_title": "Extractive Summarization for Long Answers", "published_at": "2026-09-23T10:00:00Z", "redirects": [], "slug": "summarization-extractive-browser", "status": "published", "tags": ["nlp", "summarization", "chatbots", "algorithms"], "title": "Extractive Summarization for Long Answers"}