{
  "id": "how-browser-based-chatbots-work",
  "slug": "how-browser-based-chatbots-work",
  "title": "How Browser-Based Chatbots Work: A Deep Dive into On-Device NLP",
  "meta_title": "How Browser-Based Chatbots Work — On-Device NLP",
  "meta_description": "Learn how modern browser-based chatbots run NLP pipelines entirely client-side using ONNX, sentence transformers, and reinforcement learning.",
  "status": "published",
  "published_at": "2026-05-20T10:00:00Z",
  "updated_at": "2026-09-09T00:00:00Z",
  "author": "ReLU.chat",
  "excerpt": "A technical deep dive into how modern browser-based chatbots run full NLP pipelines client-side using quantized ONNX models, BM25 retrieval, and RL-trained policy networks.",
  "content": "<aside class=\"release-note\"><strong>Implementation update · September 9, 2026</strong><p>This article describes an earlier design. The current release starts with keyword matching, offers an optional model download, renders complete answers, and caches public knowledge embeddings without saving conversations. The new CPU policy uses supervised training followed by contextual-bandit REINFORCE; Float32 inference is the default. See <a href=\"/how-it-works.html\">the current architecture and limits</a> and <a href=\"/data/policy-evaluation.json\">measured results</a>.</p></aside>\n# How Browser-Based Chatbots Work\n\nThe idea of running a chatbot entirely in your browser — without sending a single byte to a remote server — was science fiction just a few years ago. Today, thanks to advances in model quantization, WebAssembly, and the ONNX Runtime, it's production reality.\n\n## The Core Challenge\n\nTraditional chatbots rely on cloud APIs: you send a query, a server runs inference, and you get a response. This introduces latency, privacy concerns, and dependency on external services. Browser-based chatbots flip this model entirely.\n\n## The Embedding Layer\n\nEverything starts with embeddings. A sentence transformer like `all-MiniLM-L6-v2` converts text into 384-dimensional vectors. In ReLU.chat, this model is quantized to ONNX format (~22MB) and runs via ONNX Runtime WebAssembly.\n\n```javascript\nconst embeddings = await session.run({ input_ids, attention_mask });\nconst vector = embeddings.last_hidden_state.data;\n```\n\nThe quantization step is critical: the original model is ~90MB, but INT8 quantization brings it to ~22MB with minimal accuracy loss. That's small enough to load on a mobile connection.\n\n## BM25 Sparse Retrieval\n\nAlongside dense embeddings, we use BM25 — a classic information retrieval algorithm. BM25 scores documents based on term frequency and inverse document frequency. The key formula:\n\n`score(D, Q) = Σ IDF(qi) * (f(qi, D) * (k1 + 1)) / (f(qi, D) + k1 * (1 - b + b * |D| / avgdl))`\n\nBM25 is fast, requires no GPU, and catches keyword matches that dense embeddings might miss.\n\n## The Signal Layer\n\nThe signal layer fuses multiple retrieval signals into a single decision packet:\n\n- Dense cosine similarity (semantic match)\n- BM25 score (keyword match)\n- Entity overlap (named entity recognition)\n- Intent classification (what the user wants)\n- Follow-up detection (context continuity)\n\nThese 25 features become the input to the policy network.\n\n## The Policy Network\n\nA 3-layer MLP (25 → 128 → 64 → 6 action heads) decides how to respond. Trained via reinforcement learning, it learns to balance:\n\n- Factual accuracy vs. creative elaboration\n- Short vs. detailed responses\n- Direct answers vs. follow-up questions\n\nWhen the MLP is unavailable, a parameterized heuristic fallback handles response planning.\n\n## Fragment Composition\n\nThe final response isn't generated token-by-token like an LLM. Instead, it's composed from pre-written knowledge fragments connected by linguistic connectors. This approach guarantees factual accuracy (fragments are curated) while allowing natural-sounding output.\n\n## Why It Matters\n\nBrowser-based chatbots offer three key advantages:\n\n1. **Privacy**: No data leaves your device. Ever.\n2. **Speed**: Sub-100ms inference with no network round-trip.\n3. **Offline**: Works without internet after initial load.\n\nThe tradeoff is knowledge scope: these chatbots know what's in their knowledge base, not the entire internet. For domain-specific applications — customer support, documentation, education — this is often the right tradeoff.\n\n## Try It Yourself\n\nReLU.chat is open-source and runs entirely in your browser. Visit the [live demo](https://relu.chat/#showcase) or explore the [full architecture](https://relu.chat/how-it-works.html).",
  "cover_image": "assets/blog/browser-chatbots.png",
  "cover_image_alt": "Abstract connected nodes representing browser-based NLP processing",
  "tags": [
    "nlp",
    "on-device-ai",
    "chatbots",
    "onnx",
    "browser"
  ],
  "redirects": []
}
