{"author": "ReLU.chat", "content": "# Lightweight Sentiment Analysis in the Browser\n\nKnowing whether a user sounds frustrated, satisfied, or confused lets a chatbot adjust its tone, offer help earlier, or escalate to a human. Full neural sentiment models are overkill for this signal: lexicon scoring and tiny classifiers deliver useful accuracy with zero network calls.\n\n## Lexicon scoring: the simplest baseline\n\nA sentiment lexicon maps words to polarity scores — 'excellent' at +3, 'okay' at +1, 'broken' at -2, 'terrible' at -3. Score a message by summing its words' values, flipping signs after negations:\n\n```javascript\nfunction sentimentScore(tokens, lexicon) {\n  let score = 0;\n  let negate = false;\n  for (const t of tokens) {\n    if (t === 'not' || t === 'never' || t === 'no') { negate = !negate; continue; }\n    const v = lexicon[t] || 0;\n    score += negate ? -v : v;\n    if (/[.?!]/.test(t)) negate = false;\n  }\n  return score;\n}\n```\n\nA lexicon of two to three thousand words covers most chat vocabulary and ships as a ~30 KB JSON file. Keep negation words out of your [stop-word list](/blog/stop-words-stemming-small-retrieval/) or this step silently breaks.\n\n## Handling intensifiers and tone\n\nRaw sums miss 'very', 'extremely', and stretched words like 'sooo'. Multiply the next word's score by 1.5 after intensifiers, and normalize elongated spellings ('baaad' becomes 'bad' with a small magnitude boost) during [normalization](/blog/stop-words-stemming-small-retrieval/). Emoji carry strong signal too: map common emoji to scores in the same lexicon rather than stripping them.\n\n## A tiny learned classifier\n\nWhen lexicons plateau, train a logistic regression over unigram and bigram features. A few hundred labeled chat messages produce a model with a few thousand weights — small enough to hardcode as JSON and evaluate with a dot product. This is the same [prototype classification](/blog/prototype-intent-classification/) spirit: simple geometry over text features, no deep learning required.\n\nEvaluate with a [confusion matrix](/blog/confusion-matrix-intent-classification/) to see which classes confuse the model. Sentiment classifiers typically confuse neutral with mildly positive more than they confuse positive with negative, which matters when only strong negativity triggers escalation.\n\n## Using sentiment in conversation\n\nSentiment is a control signal, not a display feature. Practical uses:\n\n- **Early help:** two consecutive negative messages trigger a clarifying question or a human handoff.\n- **Tone matching:** brief, direct answers for frustrated users; fuller explanations for curious ones.\n- **Topic guarding:** negative sentiment plus [topic correction](/blog/topic-correction-when-users-redirect/) suggests the last answer missed, so re-retrieve instead of continuing.\n\nNever announce the detected sentiment ('You seem angry!'). Users find it creepy and it is wrong often enough to erode trust.\n\n## Privacy advantage\n\nServer-side sentiment APIs send every message to a third party for analysis. A lexicon or tiny classifier runs entirely on device, consistent with a [privacy-first architecture](/blog/privacy-first-ai-browsers/). The sentiment score never leaves the tab — only the conversation behavior it triggers is visible.", "cover_image_alt": "Message scored on a negative-to-positive sentiment scale", "excerpt": "Detect user sentiment on device with lexicons and tiny classifiers: scoring code, negation handling, intensifiers, and how to use the signal well.", "id": "sentiment-analysis-browser-no-server", "meta_description": "Browser sentiment analysis without servers: lexicon scoring, negation, tiny classifiers, and conversation uses, with code.", "meta_title": "Sentiment Analysis in the Browser, No Server", "published_at": "2026-09-21T10:00:00Z", "redirects": [], "slug": "sentiment-analysis-browser-no-server", "status": "published", "tags": ["nlp", "browser", "chatbots", "classification"], "title": "Lightweight Sentiment Analysis in the Browser"}